TaxonId,Kingdom,Phylum,Class,Order,Family,Genus,Species,Subspecies,scientific+AF8-name,RankName,CurrentListing,SynonymsWithAuthors,CitesAccepted,All+AF8-DistributionISOCodes,All+AF8-DistributionFullNames,NativeDistributionFullNames,Introduced+AF8-Distribution
1009,Animalia,Chordata,Aves,Psittaciformes,Psittacidae,Agapornis,,,Agapornis,GENUS,II/NC,,true,,,,
10326,Animalia,Chordata,Aves,Psittaciformes,Psittacidae,Agapornis,canus,,Agapornis canus,SPECIES,II,Psittacus canus Gmelin  1788,true,KM  MG  MU  YT  SC,Comoros  Madagascar  Mauritius  Mayotte  Seychelles,Madagascar,Comoros Mauritius Mayotte
9928,Animalia,Chordata,Aves,Psittaciformes,Psittacidae,Agapornis,fischeri,,Agapornis fischeri,SPECIES,II,,true,BI  KE  MZ  RW  TZ,Burundi  Kenya  Mozambique  Rwanda  United Republic of Tanzania,Burundi Mozambique Rwanda United Republic of Tanzania,Kenya
10797,Animalia,Chordata,Aves,Psittaciformes,Psittacidae,Agapornis,lilianae,,Agapornis lilianae,SPECIES,II,,true,MW  MZ  TZ  ZM  ZW,Malawi  Mozambique  United Republic of Tanzania  Zambia  Zimbabwe,Malawi Mozambique United Republic of Tanzania Zambia Zimbabwe,
6513,Animalia,Chordata,Aves,Psittaciformes,Psittacidae,Agapornis,nigrigenis,,Agapornis nigrigenis,SPECIES,II,Agapornis lilianae nigrigenis Shelley  1894,true,BW  NA  ZM  ZW,Botswana  Namibia  Zambia  Zimbabwe,Botswana Namibia Zambia Zimbabwe,
8415,Animalia,Chordata,Aves,Psittaciformes,Psittacidae,Agapornis,personatus,,Agapornis personatus,SPECIES,II,,true,BI  KE  TZ,Burundi  Kenya  United Republic of Tanzania,United Republic of Tanzania,Burundi Kenya
7711,Animalia,Chordata,Aves,Psittaciformes,Psittacidae,Agapornis,pullarius,,Agapornis pullarius,SPECIES,II,Psittacus pullarius Linnaeus  1758,true,AO  BJ  BI  CM  CF  TD  CG  CI  CD  GQ  ET  GA  GH  GN  KE  LR  ML  NE  NG  RW  ST  SL  SS  TG  UG  TZ,Angola  Benin  Burundi  Cameroon  Central African Republic  Chad  Congo  C+//0Aw//9ALQ-te d'Ivoire  Democratic Republic of the Congo  Equatorial Guinea  Ethiopia  Gabon  Ghana  Guinea  Kenya  Liberia  Mali  Niger  Nigeria  Rwanda  Sao Tome and Principe  Sierra Leone  South Sudan  Togo  Uganda  United Republic of Tanzania,Angola Benin Burundi Cameroon Central African Republic Chad Congo C+//0Aw//9ALQ-te d'Ivoire Democratic Republic of the Congo Equatorial Guinea Ethiopia Gabon Ghana Guinea Kenya Mali Niger Nigeria Rwanda Sao Tome and Principe Sierra Leone South Sudan Togo Uganda United Republic of Tanzania,Liberia
7767,Animalia,Chordata,Aves,Psittaciformes,Psittacidae,Agapornis,roseicollis,,Agapornis roseicollis,SPECIES,NC,Psittacus roseicollis Vieillot  1818,true,AO  BW  NA  ZA,Angola  Botswana  Namibia  South Africa,Angola Botswana Namibia South Africa,
10529,Animalia,Chordata,Aves,Psittaciformes,Psittacidae,Agapornis,swindernianus,,Agapornis swindernianus,SPECIES,II,Psittacus swindernianus Kuhl  1820,true,CM  CF  CG  CI  CD  GQ  GA  GH  LR  SL  UG,Cameroon  Central African Republic  Congo  C+//0Aw//9ALQ-te d'Ivoire  Democratic Republic of the Congo  Equatorial Guinea  Gabon  Ghana  Liberia  Sierra Leone  Uganda,Cameroon Central African Republic Congo C+//0Aw//9ALQ-te d'Ivoire Democratic Republic of the Congo Equatorial Guinea Gabon Ghana Liberia Sierra Leone Uganda,
4988,Animalia,Chordata,Aves,Psittaciformes,Psittacidae,Agapornis,taranta,,Agapornis taranta,SPECIES,II,Psittacus taranta Stanley  1814,true,ER  ET,Eritrea  Ethiopia,Eritrea Ethiopia,
1356,Animalia,Chordata,Aves,Psittaciformes,Psittacidae,Alisterus,,,Alisterus,GENUS,II,,true,,,,
3299,Animalia,Chordata,Aves,Psittaciformes,Psittacidae,Alisterus,amboinensis,,Alisterus amboinensis,SPECIES,II,Psittacus amboinensis Linnaeus  1766,true,ID,Indonesia,Indonesia,
4896,Animalia,Chordata,Aves,Psittaciformes,Psittacidae,Alisterus,chloropterus,,Alisterus chloropterus,SPECIES,II,Aprosmictus chloropterus Ramsay  1879,true,ID  PG,Indonesia  Papua New Guinea,Indonesia Papua New Guinea,
9969,Animalia,Chordata,Aves,Psittaciformes,Psittacidae,Alisterus,scapularis,,Alisterus scapularis,SPECIES,II,Psittacus scapularis Lichtenstein  1818,true,AU,Australia,Australia,
2607,Animalia,Chordata,Aves,Psittaciformes,Psittacidae,Amazona,,,Amazona,GENUS,I/II,,true,,,,
7524,Animalia,Chordata,Aves,Psittaciformes,Psittacidae,Amazona,aestiva,,Amazona aestiva,SPECIES,II,Psittacus aestivus Linnaeus  1758,true,AR  BO  BR  PY  UY,Argentina  Bolivia (Plurinational State of)  Brazil  Paraguay  Uruguay,Argentina Bolivia (Plurinational State of) Brazil Paraguay Uruguay,
5204,Animalia,Chordata,Aves,Psittaciformes,Psittacidae,Amazona,agilis,,Amazona agilis,SPECIES,II,Psittacus agilis Linnaeus  1758,true,JM,Jamaica,Jamaica,
9077,Animalia,Chordata,Aves,Psittaciformes,Psittacidae,Amazona,albifrons,,Amazona albifrons,SPECIES,II,Psittacus albifrons Sparrman  1788,true,BZ  CR  SV  GT  HN  MX  NI,Belize  Costa Rica  El Salvador  Guatemala  Honduras  Mexico  Nicaragua,Belize Costa Rica El Salvador Guatemala Honduras Mexico Nicaragua,
4166,Animalia,Chordata,Aves,Psittaciformes,Psittacidae,Amazona,amazonica,,Amazona amazonica,SPECIES,II,Psittacus amazonicus Linnaeus  1766,true,BO  BR  CO  EC  GF  GY  AN  PE  PR  SR  TT  VE,Bolivia (Plurinational State of)  Brazil  Colombia  Ecuador  French Guiana +AFs-FR+AF0-  Guyana  Netherlands Antilles  Peru  Puerto Rico  Suriname  Trinidad and Tobago  Venezuela (Bolivarian Republic of),Bolivia (Plurinational State of) Brazil Colombia Ecuador French Guiana +AFs-FR+AF0- Guyana Peru Suriname Trinidad and Tobago Venezuela (Bolivarian Republic of),Netherlands Antilles Puerto Rico
5156,Animalia,Chordata,Aves,Psittaciformes,Psittacidae,Amazona,arausiaca,,Amazona arausiaca,SPECIES,I,Psittacus arausiacus P. L. S. M+//0Aw//9ALw-ller  1766,true,DM,Dominica,Dominica,
3721,Animalia,Chordata,Aves,Psittaciformes,Psittacidae,Amazona,auropalliata,,Amazona auropalliata,SPECIES,I,Amazona ochrocephala auropalliata (Gmelin  1788)  Psittacus auropalliatus Lesson  1842,true,BZ  CR  SV  GT  HN  MX  NI,Belize  Costa Rica  El Salvador  Guatemala  Honduras  Mexico  Nicaragua,Belize Costa Rica El Salvador Guatemala Honduras Mexico Nicaragua,
5318,Animalia,Chordata,Aves,Psittaciformes,Psittacidae,Amazona,autumnalis,,Amazona autumnalis,SPECIES,II,Psittacus autumnalis Linnaeus  1758,true,BZ  BR  CO  CR  EC  GT  HN  MX  NI  PA  VE,Belize  Brazil  Colombia  Costa Rica  Ecuador  Guatemala  Honduras  Mexico  Nicaragua  Panama  Venezuela (Bolivarian Republic of),Belize Brazil Colombia Costa Rica Ecuador Guatemala Honduras Mexico Nicaragua Panama Venezuela (Bolivarian Republic of),
10032,Animalia,Chordata,Aves,Psittaciformes,Psittacidae,Amazona,barbadensis,,Amazona barbadensis,SPECIES,I,Psittacus barbadensis Gmelin  1788,true,AW  AN  VE,Aruba  Netherlands Antilles  Venezuela (Bolivarian Republic of),Aruba Netherlands Antilles Venezuela (Bolivarian Republic of),
8961,Animalia,Chordata,Aves,Psittaciformes,Psittacidae,Amazona,brasiliensis,,Amazona brasiliensis,SPECIES,I,Psittacus brasiliensis Linnaeus  1758,true,BR  UY,Brazil  Uruguay,Brazil Uruguay,
5816,Animalia,Chordata,Aves,Psittaciformes,Psittacidae,Amazona,collaria,,Amazona collaria,SPECIES,II,Psittacus collarius Linnaeus  1758,true,JM,Jamaica,Jamaica,
5571,Animalia,Chordata,Aves,Psittaciformes,Psittacidae,Amazona,dufresniana,,Amazona dufresniana,SPECIES,II,Psittacus dufresnianus Shaw  1812,true,BR  GF  GY  SR  VE,Brazil  French Guiana +AFs-FR+AF0-  Guyana  Suriname  Venezuela (Bolivarian Republic of),French Guiana +AFs-FR+AF0- Guyana Suriname Venezuela (Bolivarian Republic of),
10655,Animalia,Chordata,Aves,Psittaciformes,Psittacidae,Amazona,farinosa,,Amazona farinosa,SPECIES,II,Psittacus farinosus Boddaert  1783,true,BZ  BO  BR  CO  CR  EC  GF  GT  GY  HN  MX  NI  PA  PE  SR  VE,Belize  Bolivia (Plurinational State of)  Brazil  Colombia  Costa Rica  Ecuador  French Guiana +AFs-FR+AF0-  Guatemala  Guyana  Honduras  Mexico  Nicaragua  Panama  Peru  Suriname  Venezuela (Bolivarian Republic of),Belize Bolivia (Plurinational State of) Brazil Colombia Costa Rica Ecuador French Guiana +AFs-FR+AF0- Guatemala Guyana Honduras Mexico Nicaragua Panama Peru Suriname Venezuela (Bolivarian Republic of),
8116,Animalia,Chordata,Aves,Psittaciformes,Psittacidae,Amazona,festiva,,Amazona festiva,SPECIES,II,Psittacus festivus Linnaeus  1758,true,BR  CO  EC  GY  PE  VE,Brazil  Colombia  Ecuador  Guyana  Peru  Venezuela (Bolivarian Republic of),Brazil Colombia Ecuador Guyana Peru Venezuela (Bolivarian Republic of),
5511,Animalia,Chordata,Aves,Psittaciformes,Psittacidae,Amazona,finschi,,Amazona finschi,SPECIES,I,Chrysotis finschi Sclater  1864,true,MX,Mexico,Mexico,
9807,Animalia,Chordata,Aves,Psittaciformes,Psittacidae,Amazona,guildingii,,Amazona guildingii,SPECIES,I,Psittacus guildingii Vigors  1837,true,VC,Saint Vincent and the Grenadines,Saint Vincent and the Grenadines,
8804,Animalia,Chordata,Aves,Psittaciformes,Psittacidae,Amazona,imperialis,,Amazona imperialis,SPECIES,I,,true,DM,Dominica,Dominica,
10208,Animalia,Chordata,Aves,Psittaciformes,Psittacidae,Amazona,kawalli,,Amazona kawalli,SPECIES,II,,true,BR,Brazil,Brazil,
7836,Animalia,Chordata,Aves,Psittaciformes,Psittacidae,Amazona,leucocephala,,Amazona leucocephala,SPECIES,I,Psittacus leucocephalus Linnaeus  1758,true,BS  KY  CU,Bahamas  Cayman Islands (United Kingdom)  Cuba,Bahamas Cayman Islands (United Kingdom) Cuba,
3948,Animalia,Chordata,Aves,Psittaciformes,Psittacidae,Amazona,mercenaria,,Amazona mercenaria,SPECIES,II,Amazona mercenarius (Tschudi  1844)  Psittacus mercenarius Tschudi  1844,true,AR  BO  CO  EC  PE  VE,Argentina  Bolivia (Plurinational State of)  Colombia  Ecuador  Peru  Venezuela (Bolivarian Republic of),Argentina Bolivia (Plurinational State of) Colombia Ecuador Peru Venezuela (Bolivarian Republic of),
10835,Animalia,Chordata,Aves,Psittaciformes,Psittacidae,Amazona,ochrocephala,,Amazona ochrocephala,SPECIES,II,Psittacus ochrocephalus Gmelin  1788,true,BZ  BO  BR  CO  CR  EC  GF  GT  GY  HN  MX  NI  PA  PE  SR  TT  VE,Belize  Bolivia (Plurinational State of)  Brazil  Colombia  Costa Rica  Ecuador  French Guiana +AFs-FR+AF0-  Guatemala  Guyana  Honduras  Mexico  Nicaragua  Panama  Peru  Suriname  Trinidad and Tobago  Venezuela (Bolivarian Republic of),Belize Bolivia (Plurinational State of) Brazil Colombia Costa Rica Ecuador French Guiana +AFs-FR+AF0- Guatemala Guyana Honduras Mexico Nicaragua Panama Peru Suriname Trinidad and Tobago Venezuela (Bolivarian Republic of),
11033,Animalia,Chordata,Aves,Psittaciformes,Psittacidae,Amazona,oratrix,,Amazona oratrix,SPECIES,I,Amazona ochrocephala oratrix (J. F. Gmelin  1788)  Amazona oratrix magna Ridgway  1887  Amazona ochrocephala magna (J. F. Gmelin  1788),true,BZ  GT  HN  MX  PR,Belize  Guatemala  Honduras  Mexico  Puerto Rico,Belize Guatemala Honduras Mexico,Puerto Rico
4520,Animalia,Chordata,Aves,Psittaciformes,Psittacidae,Amazona,pretrei,,Amazona pretrei,SPECIES,I,Psittacus pretrei Temminck  1830,true,AR  BR  PY  UY,Argentina  Brazil  Paraguay  Uruguay,Argentina Brazil Paraguay,
6713,Animalia,Chordata,Aves,Psittaciformes,Psittacidae,Amazona,rhodocorytha,,Amazona rhodocorytha,SPECIES,I,Chrysotis rhodocorytha Salvadori  1890  Amazona dufresniana rhodocorytha (Shaw  1812),true,BR,Brazil,Brazil,
7498,Animalia,Chordata,Aves,Psittaciformes,Psittacidae,Amazona,tucumana,,Amazona tucumana,SPECIES,I,Chrysotis tucumana Cabanis  1885  Amazona pretrei tucumana (Temminck  1830),true,AR  BO,Argentina  Bolivia (Plurinational State of),Argentina Bolivia (Plurinational State of),
5359,Animalia,Chordata,Aves,Psittaciformes,Psittacidae,Amazona,ventralis,,Amazona ventralis,SPECIES,II,Psittacus ventralis P. L. S. M+//0Aw//9ALw-ller  1776,true,DO  HT  PR,Dominican Republic  Haiti  Puerto Rico,Dominican Republic Haiti,Puerto Rico
9547,Animalia,Chordata,Aves,Psittaciformes,Psittacidae,Amazona,versicolor,,Amazona versicolor,SPECIES,I,Psittacus versicolor P. L. S. M+//0Aw//9ALw-ller  1776,true,LC,Saint Lucia,Saint Lucia,
11137,Animalia,Chordata,Aves,Psittaciformes,Psittacidae,Amazona,vinacea,,Amazona vinacea,SPECIES,I,Psittacus vinaceus Kuhl  1820,true,AR  BR  PY,Argentina  Brazil  Paraguay,Argentina Brazil Paraguay,
6777,Animalia,Chordata,Aves,Psittaciformes,Psittacidae,Amazona,viridigenalis,,Amazona viridigenalis,SPECIES,I,Chrysotis viridigenalis Cassin  1853,true,MX  PR  US,Mexico  Puerto Rico  United States of America,Mexico,Puerto Rico United States of America
9524,Animalia,Chordata,Aves,Psittaciformes,Psittacidae,Amazona,vittata,,Amazona vittata,SPECIES,I,Psittacus vittatus Boddaert  1783,true,PR,Puerto Rico,Puerto Rico,
9861,Animalia,Chordata,Aves,Psittaciformes,Psittacidae,Amazona,xantholora,,Amazona xantholora,SPECIES,II,Chrysotis xantholora G. R. Gray  1859,true,BZ  HN  MX,Belize  Honduras  Mexico,Belize Mexico,
3256,Animalia,Chordata,Aves,Psittaciformes,Psittacidae,Amazona,xanthops,,Amazona xanthops,SPECIES,II,Psittacus xanthops Spix  1824  Alipiopsitta xanthops (von Spix  1824),true,BO  BR  PY,Bolivia (Plurinational State of)  Brazil  Paraguay,Bolivia (Plurinational State of) Brazil Paraguay,
1511,Animalia,Chordata,Aves,Psittaciformes,Psittacidae,Anodorhynchus,,,Anodorhynchus,GENUS,I/NC,,true,,,,
5002,Animalia,Chordata,Aves,Psittaciformes,Psittacidae,Anodorhynchus,glaucus,,Anodorhynchus glaucus,SPECIES,I,Macrocercus glaucus Vieillot  1816,true,AR  BR  PY  UY,Argentina  Brazil  Paraguay  Uruguay,Argentina Brazil,
8986,Animalia,Chordata,Aves,Psittaciformes,Psittacidae,Anodorhynchus,hyacinthinus,,Anodorhynchus hyacinthinus,SPECIES,I/NC,Psittacus hyacinthinus Latham  1790,true,BO  BR  PY,Bolivia (Plurinational State of)  Brazil  Paraguay,Bolivia (Plurinational State of) Brazil Paraguay,
5579,Animalia,Chordata,Aves,Psittaciformes,Psittacidae,Anodorhynchus,leari,,Anodorhynchus leari,SPECIES,I,,true,BR,Brazil,Brazil,
2005,Animalia,Chordata,Aves,Psittaciformes,Psittacidae,Aprosmictus,,,Aprosmictus,GENUS,II,,true,,,,
4055,Animalia,Chordata,Aves,Psittaciformes,Psittacidae,Aprosmictus,erythropterus,,Aprosmictus erythropterus,SPECIES,II,Psittacus erythropterus Gmelin  1788,true,AU  ID  PG,Australia  Indonesia  Papua New Guinea,Australia Indonesia Papua New Guinea,
6087,Animalia,Chordata,Aves,Psittaciformes,Psittacidae,Aprosmictus,jonquillaceus,,Aprosmictus jonquillaceus,SPECIES,II,Psittacus jonquillaceus Vieillot  1818,true,ID  TL,Indonesia  Timor+AC0-Leste,Indonesia Timor+AC0-Leste,
1889,Animalia,Chordata,Aves,Psittaciformes,Psittacidae,Ara,,,Ara,GENUS,I/II,,true,,,,
11207,Animalia,Chordata,Aves,Psittaciformes,Psittacidae,Ara,ambiguus,,Ara ambiguus,SPECIES,I,Ara ambigua (Bechstein  1811)  Psittacus ambiguus Bechstein  1811,true,CO  CR  EC  HN  NI  PA,Colombia  Costa Rica  Ecuador  Honduras  Nicaragua  Panama,Colombia Costa Rica Ecuador Honduras Nicaragua Panama,
3879,Animalia,Chordata,Aves,Psittaciformes,Psittacidae,Ara,ararauna,,Ara ararauna,SPECIES,II,Sittace caninde Wagler  1832  Psittacus ararauna Linnaeus  1758  Ara caninde Wagler  1832,true,BO  BR  CO  EC  GF  GY  PA  PY  PE  PR  SR  TT  VE,Bolivia (Plurinational State of)  Brazil  Colombia  Ecuador  French Guiana +AFs-FR+AF0-  Guyana  Panama  Paraguay  Peru  Puerto Rico  Suriname  Trinidad and Tobago  Venezuela (Bolivarian Republic of),Bolivia (Plurinational State of) Brazil Colombia Ecuador French Guiana +AFs-FR+AF0- Guyana Panama Paraguay Peru Suriname Venezuela (Bolivarian Republic of),Puerto Rico
8383,Animalia,Chordata,Aves,Psittaciformes,Psittacidae,Ara,chloropterus,,Ara chloropterus,SPECIES,II,Ara chloroptera Gray  1859,true,AR  BO  BR  CO  EC  GF  GY  PA  PY  PE  SR  VE,Argentina  Bolivia (Plurinational State of)  Brazil  Colombia  Ecuador  French Guiana +AFs-FR+AF0-  Guyana  Panama  Paraguay  Peru  Suriname  Venezuela (Bolivarian Republic of),Argentina Bolivia (Plurinational State of) Brazil Colombia Ecuador French Guiana +AFs-FR+AF0- Guyana Panama Paraguay Peru Suriname Venezuela (Bolivarian Republic of),
6768,Animalia,Chordata,Aves,Psittaciformes,Psittacidae,Ara,glaucogularis,,Ara glaucogularis,SPECIES,I,,true,BO,Bolivia (Plurinational State of),Bolivia (Plurinational State of),
4650,Animalia,Chordata,Aves,Psittaciformes,Psittacidae,Ara,macao,,Ara macao,SPECIES,I,Psittacus macao Linnaeus  1758,true,BZ  BO  BR  CO  CR  EC  SV  GF  GT  GY  HN  MX  NI  PA  PE  SR  TT  VE,Belize  Bolivia (Plurinational State of)  Brazil  Colombia  Costa Rica  Ecuador  El Salvador  French Guiana +AFs-FR+AF0-  Guatemala  Guyana  Honduras  Mexico  Nicaragua  Panama  Peru  Suriname  Trinidad and Tobago  Venezuela (Bolivarian Republic of),Belize Bolivia (Plurinational State of) Brazil Colombia Costa Rica Ecuador French Guiana +AFs-FR+AF0- Guatemala Guyana Honduras Mexico Nicaragua Panama Peru Suriname Venezuela (Bolivarian Republic of),
5570,Animalia,Chordata,Aves,Psittaciformes,Psittacidae,Ara,militaris,,Ara militaris,SPECIES,I,Psittacus militaris Linnaeus  1766,true,AR  BO  CO  EC  GT  MX  PE  VE,Argentina  Bolivia (Plurinational State of)  Colombia  Ecuador  Guatemala  Mexico  Peru  Venezuela (Bolivarian Republic of),Bolivia (Plurinational State of) Colombia Ecuador Mexico Peru Venezuela (Bolivarian Republic of),
6826,Animalia,Chordata,Aves,Psittaciformes,Psittacidae,Ara,rubrogenys,,Ara rubrogenys,SPECIES,I,,true,BO,Bolivia (Plurinational State of),Bolivia (Plurinational State of),
8817,Animalia,Chordata,Aves,Psittaciformes,Psittacidae,Ara,severus,,Ara severus,SPECIES,II,Ara severa (Linnaeus  1758)  Psittacus severus Linnaeus  1758,true,BO  BR  CO  EC  GF  GY  PA  PE  SR  US  VE,Bolivia (Plurinational State of)  Brazil  Colombia  Ecuador  French Guiana +AFs-FR+AF0-  Guyana  Panama  Peru  Suriname  United States of America  Venezuela (Bolivarian Republic of),Bolivia (Plurinational State of) Brazil Colombia Ecuador French Guiana +AFs-FR+AF0- Guyana Panama Peru Suriname Venezuela (Bolivarian Republic of),United States of America
1346,Animalia,Chordata,Aves,Psittaciformes,Psittacidae,Aratinga,,,Aratinga,GENUS,II,,true,,,,
3224,Animalia,Chordata,Aves,Psittaciformes,Psittacidae,Aratinga,acuticaudata,,Aratinga acuticaudata,SPECIES,II,Thectocercus acuticaudatus (Vieillot  1818)  Psittacus acuticaudatus Vieillot  1818  Psittacara acuticaudatus (Vieillot  1818),true,AR  BO  BR  CO  PY  US  UY  VE,Argentina  Bolivia (Plurinational State of)  Brazil  Colombia  Paraguay  United States of America  Uruguay  Venezuela (Bolivarian Republic of),Argentina Bolivia (Plurinational State of) Brazil Colombia Paraguay United States of America Venezuela (Bolivarian Republic of),
10092,Animalia,Chordata,Aves,Psittaciformes,Psittacidae,Aratinga,aurea,,Aratinga aurea,SPECIES,II,Eupsittula aurea (J. F. Gmelin  1788)  Psittacus aureus Gmelin  1788,true,AR  BO  BR  PY  PE  SR,Argentina  Bolivia (Plurinational State of)  Brazil  Paraguay  Peru  Suriname,Argentina Bolivia (Plurinational State of) Brazil Paraguay Peru Suriname,
9191,Animalia,Chordata,Aves,Psittaciformes,Psittacidae,Aratinga,auricapillus,,Aratinga auricapillus,SPECIES,II,Psittacus auricapillus Kuhl  1820  Aratinga auricapilla (Kuhl  1820),true,BR,Brazil,Brazil,
3944,Animalia,Chordata,Aves,Psittaciformes,Psittacidae,Aratinga,cactorum,,Aratinga cactorum,SPECIES,II,Eupsittula cactorum (Kuhl  1820)  Psittacus cactorum Kuhl  1820  Eupsittula cactorum (Spix  1824),true,BR,Brazil,Brazil,
11275,Animalia,Chordata,Aves,Psittaciformes,Psittacidae,Aratinga,canicularis,,Aratinga canicularis,SPECIES,II,Eupsittula canicularis (Linnaeus  1758)  Psittacus canicularis Linnaeus  1758,true,CR  SV  GT  HN  MX  NI  PR,Costa Rica  El Salvador  Guatemala  Honduras  Mexico  Nicaragua  Puerto Rico,Costa Rica El Salvador Guatemala Honduras Mexico Nicaragua,Puerto Rico
10168,Animalia,Chordata,Aves,Psittaciformes,Psittacidae,Aratinga,chloroptera,,Aratinga chloroptera,SPECIES,II,Psittacara chloroptera Souanc+//0Aw//9AKk-  1856,true,DO  HT  PR,Dominican Republic  Haiti  Puerto Rico,Dominican Republic Haiti,Puerto Rico
7143,Animalia,Chordata,Aves,Psittaciformes,Psittacidae,Aratinga,erythrogenys,,Aratinga erythrogenys,SPECIES,II,Psittacara erythrogenys Lesson  1844,true,EC  PE,Ecuador  Peru,Ecuador Peru,
8739,Animalia,Chordata,Aves,Psittaciformes,Psittacidae,Aratinga,euops,,Aratinga euops,SPECIES,II,Psittacara euops (Wagler  1832)  Sittace euops Wagler  1832,true,CU,Cuba,Cuba,
4313,Animalia,Chordata,Aves,Psittaciformes,Psittacidae,Aratinga,finschi,,Aratinga finschi,SPECIES,II,Conurus finschi Salvin  1871  Psittacara finschi (Salvin  1871),true,CR  NI  PA,Costa Rica  Nicaragua  Panama,Costa Rica Nicaragua Panama,
5325,Animalia,Chordata,Aves,Psittaciformes,Psittacidae,Aratinga,holochlora,,Aratinga holochlora,SPECIES,II,Psittacara holochlora (P. L. Sclater  1859)  Conurus rubritorquis Sclater  1887  Aratinga rubritorquis (Sclater  1887)  Conurus holochlorus Sclater  1859  Aratinga brevipes (Lawrence  1871),true,SV  GT  HN  MX  NI,El Salvador  Guatemala  Honduras  Mexico  Nicaragua,El Salvador Guatemala Honduras Mexico Nicaragua,
7663,Animalia,Chordata,Aves,Psittaciformes,Psittacidae,Aratinga,jandaya,,Aratinga jandaya,SPECIES,II,Psittacus jandaya Gmelin  1788,true,BR,Brazil,Brazil,
8280,Animalia,Chordata,Aves,Psittaciformes,Psittacidae,Aratinga,leucophthalma,,Aratinga leucophthalma,SPECIES,II,Psittacus leucophthalmus P. L. S. M+//0Aw//9ALw-ller  1776  Aratinga leucophthalmus (M+//0Aw//9ALw-ller  1776)  Psittacara leucophthalmus (Statius M+//0Aw//9ALw-ller  1776)  Psittacara leucophthalma (Statius M+//0Aw//9ALw-ller  1776),true,AR  BO  BR  CO  EC  GF  GY  PY  PE  SR  UY  VE,Argentina  Bolivia (Plurinational State of)  Brazil  Colombia  Ecuador  French Guiana +AFs-FR+AF0-  Guyana  Paraguay  Peru  Suriname  Uruguay  Venezuela (Bolivarian Republic of),Argentina Bolivia (Plurinational State of) Brazil Colombia Ecuador French Guiana +AFs-FR+AF0- Guyana Paraguay Peru Suriname Uruguay Venezuela (Bolivarian Republic of),
5500,Animalia,Chordata,Aves,Psittaciformes,Psittacidae,Aratinga,maculata,,Aratinga maculata,SPECIES,II,Aratinga pintoi Silveira  Lima +ACY- H+//0Aw//9ALY-fling  2005,true,BR,Brazil,Brazil,
10115,Animalia,Chordata,Aves,Psittaciformes,Psittacidae,Aratinga,mitrata,,Aratinga mitrata,SPECIES,II,Conurus mitratus Tschudi  1844  Psittacara mitrata (Tschudi  1844)  Aratinga alticola Chapman  1921  Psittacara mitratus (Tschudi  1844),true,AR  BO  PE  UY,Argentina  Bolivia (Plurinational State of)  Peru  Uruguay,Argentina Bolivia (Plurinational State of) Peru,Uruguay
9864,Animalia,Chordata,Aves,Psittaciformes,Psittacidae,Aratinga,nana,,Aratinga nana,SPECIES,II,Psittacara nana Vigors  1830  Eupsittula nana (Vigors  1830),true,BZ  CR  DO  GT  HN  JM  MX  NI  PA,Belize  Costa Rica  Dominican Republic  Guatemala  Honduras  Jamaica  Mexico  Nicaragua  Panama,Belize Costa Rica Dominican Republic Guatemala Honduras Jamaica Mexico Nicaragua Panama,
4797,Animalia,Chordata,Aves,Psittaciformes,Psittacidae,Aratinga,pertinax,,Aratinga pertinax,SPECIES,II,Psittacus pertinax Linnaeus  1758  Eupsittula pertinax (Linnaeus  1758),true,AW  BB  BR  CO  CR  DM  GF  GY  AN  PA  PR  SR  VE  VI,Aruba  Barbados  Brazil  Colombia  Costa Rica  Dominica  French Guiana +AFs-FR+AF0-  Guyana  Netherlands Antilles  Panama  Puerto Rico  Suriname  Venezuela (Bolivarian Republic of)  Virgin Islands of the USA,Aruba Brazil Colombia Costa Rica French Guiana +AFs-FR+AF0- Guyana Netherlands Antilles Panama Suriname Venezuela (Bolivarian Republic of),Barbados Dominica Puerto Rico Virgin Islands of the USA
7141,Animalia,Chordata,Aves,Psittaciformes,Psittacidae,Aratinga,solstitialis,,Aratinga solstitialis,SPECIES,II,Psittacus solstitialis Linnaeus  1758,true,BR  GF  GY  SR  VE,Brazil  French Guiana +AFs-FR+AF0-  Guyana  Suriname  Venezuela (Bolivarian Republic of),Brazil French Guiana +AFs-FR+AF0- Guyana Suriname Venezuela (Bolivarian Republic of),
6449,Animalia,Chordata,Aves,Psittaciformes,Psittacidae,Aratinga,strenua,,Aratinga strenua,SPECIES,II,Psittacara strenuus (Ridgway  1915),true,SV  GT  HN  MX  NI,El Salvador  Guatemala  Honduras  Mexico  Nicaragua,El Salvador Guatemala Honduras Mexico Nicaragua,
7695,Animalia,Chordata,Aves,Psittaciformes,Psittacidae,Aratinga,wagleri,,Aratinga wagleri,SPECIES,II,Conurus wagleri G. R. Gray  1845  Psittacara wagleri (G. R. Gray  1845),true,CO  EC  PE  VE,Colombia  Ecuador  Peru  Venezuela (Bolivarian Republic of),Colombia Ecuador Peru Venezuela (Bolivarian Republic of),
7392,Animalia,Chordata,Aves,Psittaciformes,Psittacidae,Aratinga,weddellii,,Aratinga weddellii,SPECIES,II,Eupsittula weddellii (Deville  1851)  Conurus weddellii Deville  1851,true,BO  BR  CO  EC  PE,Bolivia (Plurinational State of)  Brazil  Colombia  Ecuador  Peru,Bolivia (Plurinational State of) Brazil Colombia Ecuador Peru,
2281,Animalia,Chordata,Aves,Psittaciformes,Psittacidae,Barnardius,,,Barnardius,GENUS,II,,true,,,,
10765,Animalia,Chordata,Aves,Psittaciformes,Psittacidae,Barnardius,zonarius,,Barnardius zonarius,SPECIES,II,Barnardius barnardi (Vigors +ACY- Horsfield  1827)  Platycercus zonarius (Shaw  1805)  Psittacus zonarius Shaw  1805  Platycercus barnardi (Vigors +ACY- Horsfield  1827),true,AU,Australia,Australia,
2578,Animalia,Chordata,Aves,Psittaciformes,Psittacidae,Bolbopsittacus,,,Bolbopsittacus,GENUS,II,,true,,,,
4345,Animalia,Chordata,Aves,Psittaciformes,Psittacidae,Bolbopsittacus,lunulatus,,Bolbopsittacus lunulatus,SPECIES,II,Psittacus lunulatus Scopoli  1786,true,PH,Philippines,Philippines,
1716,Animalia,Chordata,Aves,Psittaciformes,Psittacidae,Bolborhynchus,,,Bolborhynchus,GENUS,II,,true,,,,
4354,Animalia,Chordata,Aves,Psittaciformes,Psittacidae,Bolborhynchus,ferrugineifrons,,Bolborhynchus ferrugineifrons,SPECIES,II,Brotogeris ferrugineifrons Lawrence  1880,true,CO,Colombia,Colombia,
